{
  "vct": "eu.we-build:duns:1",
  "iss": "did:example:duns-issuer-001",
  "iat": 1736935200,
  "exp": 1768471200,
  "attestation_legal_category": "EAA",
  "duns_number": "123456789",
  "legal_entity": {
    "legal_name": "Example GmbH",
    "legal_form": "GmbH",
    "address": {
      "street": "Musterstrasse",
      "nr": "42",
      "postal_code": "70174",
      "city": "Stuttgart",
      "country": "DE"
    }
  },
  "status": {
    "type": "status-list",
    "status_list_credential": "https://issuer.example.com/status/duns/2025",
    "status_list_index": 456,
    "status_purpose": "revocation"
  },
  "cnf": {
    "jwk": {
      "kty": "EC",
      "crv": "P-256",
      "x": "TCAER19Zvu3OHF4j4W4vfSVoHIP1ILilDls7vCeGemc",
      "y": "ZxjiWWbZMQGHVWKVQ4hbSIirsVfuecCE6t4jT9F2HZQ"
    }
  }
}